"I will create,Technology
I will provide an ebook with 25 activities for toddlers with energy,Lifestyle
I will build responsive wordpress website design,Technology
I will coach you to succeed as entrepreneur and leader,Marketing
I will do api integration and custom api,Technology
I will transcript band pieces into scores,Technology
I will record a celebrity or character impression voice for you,Lifestyle
I will build you a recruiting process,Marketing
I will send you a hand written postcard or letter from lithuania,Lifestyle
I will create cinematic hollywood animation trailer,Technology
I will provide custom pos and inventory desktop application,Technology
I will do youtube intro video trailer or animated logo,Technology
I will write meaningful mission and vision statements in 24 hours,Marketing
I will create online course and training video production,Technology
I will help you to go live like a pro,Technology
I will give you business support or feedback,Marketing
I will take 360 degree pictures for your google maps listing,Technology
I will write a great theme song for your podcast or youtube channel,Technology
I will do mind reading and telepathy soulmate reading,Lifestyle
I will tune and set in time your voice to perfection manually,Technology
I will create animation video for you,Technology
I will do classified ad posting service  all over USA,Marketing
I will create information security policy for your company,Technology
"I will build an infusionsoft campaign for any need,Marketing
"I will convert psd,Technology
I will produce professional lifestyle product photos with a dog model,Technology
"I will create a high quality,Technology
I will make a professional video music for your song,Technology
I will make you a presentation for your seminar or training program,Marketing
"I will create a logo design,Marketing
I will professionally edit your video footage,Technology
"I will boost google,Marketing
"I will cast a powerful love,Lifestyle
"I will create sound effects,Technology
"I will do data entry,Marketing
I will create restaurant promo or food promotion video,Technology
I will advertise your logo brand in expo event seminar ad,Lifestyle
I will edit a professional video for less money,Technology
I will design background music and sound effects for your project,Technology
I will create amazing 3d character model and cartoon animation video,Technology
I will train the upcoming sales executive in becoming master closers,Marketing
I will make real estate cold calls for you,Marketing
I will create animation for your chibi characters by spine pro,Technology
I will help you reactivate your amazon account suspension,Marketing
I will create webhook for dialogflow in node js and python,Technology
I will help you get the division you want iron to diamond,Lifestyle
I will remove your money spirit blocks and make you successful,Lifestyle
I will develop any desktop application using dot net framework,Technology
I will make a cross stitch pattern PDF for you,Lifestyle
I will deliver your video message as sexy policeman,Lifestyle
I will conceive unique business name brand name with logo design,Marketing
I will make donald trump to wish happy birthday,Lifestyle
I will create amazon storefront to boost your insights,Marketing
I will update and clean up your local citations,Marketing
I will create smarturl link for music streaming or podcast services,Marketing
"I will completely manage,Marketing
I will give you love and relationship astrology reading,Lifestyle
"I will edit a professional video for your ad,Technology
I will send a lovely postcard from hungary,Lifestyle
I will vladimir putin animated and voice act,Lifestyle
"I will do mathematics,Lifestyle
I will create your automated shopify dropshipping store,Technology
I will do python programming for your machine learning projects,Technology
I will write a custom unity shader,Technology
I will do organic spotify promotion within targeted audience,Marketing
I will record HD screencast instructional tutorial explainer video,Technology
"I will add chinese subtitles to english videos,Technology
I will record an american female voice over narration,Technology
I will conduct an accessibility audit on your site,Technology
I will optimize your google my business listing for local SEO,Marketing
I will record an insightful website analysis to improve conversions,Technology
I will do the funny things you can think of,Lifestyle
I will do custom animated stinger transition,Technology
I will create modern elegant slideshow,Technology
I will write crochet pattern  and send crochet products,Lifestyle
I will help sell your domain name with appraisal and landing page,Marketing
"I will develop python,Technology
I will be your product sourcing agent in china and worldwide,Marketing
I will create a realistic 3d render of your clothing or fashion product,Technology
"I will professionally fix,Technology
I will build a kickass investor pitch deck for your startup,Marketing
I will be your green screen english or spanish medical spokesperson,Technology
I will film a lifestyle video for products or brands,Technology
I will be your male model for your brand,Lifestyle
"I will help you with all the database,Technology
I will give you a pro twitch stream setup,Technology
I will do chinese trademark registration for you,Marketing
I will coach you in valorant as an immortal 3 competitive player,Lifestyle
I will transcribe your songs for any ensemble,Technology
I will compose cinematic epic orchestral music for you,Technology
I will create your automated dropshipping shopify store website,Technology
I will provide career coaching sessions,Marketing
I will narrate your book professionally,Technology
I will provide shopify stores list,Lifestyle
I will develop your project and change management strategy and plan,Marketing
I will do online vocal lessons and songwriting,Technology
I will create professional audio ads or radio commercials for your project,Technology
"I will design animated twitch,Technology
I will set up your podio to accomplish all your workflow requirements,Marketing
I will professionally design your shopify website,Technology
I will find the perfect domain name for your business or project,Marketing
I will do market research and design investor pitch deck,Marketing
I will do 3d animation with blender or maya,Technology
"I will create this cinematic promo trailer for product,Technology
I will write a pop song for you,Technology
"I will create custom sound design for intros,Technology
I will create video lessons for your online course in 3 languages,Technology
I will publish android app on google play store,Marketing
"Our studio will produce,Technology
I will do real estate skip tracing by tlo,Lifestyle
I will professionally format and design microsoft word document,Marketing
I will be your an agile business analyst,Marketing
I will record a pro voice over in english or spanish,Technology
"I will help you in discrete math,Lifestyle
"I will write winning business plan,Marketing
I will create the best spokesperson and spokesman video,Technology
I will create a professional custom logo animation,Technology
I will design creative packaging for amazon sellers,Marketing
I will produce a pro quality  jingle in any genre,Technology
"I will write a theme song for your podcast,Technology
I will perform load test and analyze performance,Technology
I will give 190 fun puzzles for family and group games for personal uses,Lifestyle
I will provide a forex account growth plan to grow 50 dollars to 50k,Marketing
I will be your songwriter and vocalist pop edm soul gospel,Technology
I will install and setup your call center on vicidial or goautodial,Technology
I will enjoy making your silly epic video as devil lucifer foe of the jesus,Lifestyle
I will 50 local business submissions non US,Marketing
I will make a cinematic minecraft server trailer,Technology
I will do pentesting of your web and mobile apps,Technology
"Our studio will create a full 2d game includes art,Technology
I will do all your typing work in under 24 hours,Marketing
I will coach rocket league 2v2 from bronze to c2,Lifestyle
"I will develop,Technology
I will make nature drone videos,Technology
I will do kindle formatting ebook book formatting and layout design for KDP,Technology
"I will be your tinder coach,Lifestyle
I will do a realistic rendering for your sketchup model with lumion,Technology
I will drive 2 million organic website traffic google  adsense safe,Marketing
I will design a premium shopify dropshipping online store plus SEO,Technology
I will human resource management and strategic management tutoring services,Marketing
I will transcribe and arrange music,Technology
"I will setup,Marketing
I will be your professional spokesperson,Technology
I will professionally mix and master your song or album,Technology
I will write compelling detailed job description,Marketing
I will format your microsoft word document,Marketing
"I will fix shopify bugs,Technology
"I will do 2d kid story telling animation,Technology
"I will write a high impact cv or resume for senior executives,Marketing
I will professionally test your game,Technology
I will improve global and USA alexa rank with traffic and backlink,Marketing
"I will create custom,Technology
I will deliver american cowboy story teller voice over,Technology
"I will perform,Technology
I will provide you with a custom guitar video lesson or live online,Technology
I will make ar VR multiplayer 3d games,Technology
"I will create custom dj drops,Technology
I will edit and master your podcast,Technology
I will ghost write professional rap song lyrics,Technology
"I will create architectural portfolio,Marketing
I will do a 101 influencer coaching call,Marketing
I will record a studio male voice over in 24 hours,Technology
I will create sound design for video or short film,Technology
I will sewing and textile production in egypt,Marketing
I will perform a vulnerability scan for your site and digital assets,Technology
I will be your professional video spokesperson,Technology
"I will record a sexy dj drop,Technology
"I will create ms access,Technology
I will set up shopify store to start selling,Marketing
"I will make 3d character animation using c4d,Technology
I will be your virtual assistant,Marketing
I will write high quality essays of any type in less than 24 hours,Lifestyle
"I will setup streamlabs obs professional looking stream,Technology
I will conduct family history  research and provide consultation,Lifestyle
I will send unlimited google traffic with guarantee,Marketing
I will do bigcommerce theme development and customization,Technology
I will wish a happy birthday from kim jong un,Lifestyle
"I will be your programmer in java,Technology
I will create awesome slideshow video,Technology
I will create an amazon product demonstration video,Technology
I will create an awesome 2d animated explainer sales video,Technology
I will help you to build your cybersecurity infrastructure strategy at optimal cost,Technology
I will add upload video to your amazon listing to increase sales,Marketing
I will tell you who your true soulmate is plus details,Lifestyle
I will impersonate games of thrones jon snow,Lifestyle
I will be the sound designer of your video or animation project,Technology
I will develop professional ms access database or sql database,Technology
I will assist with your fca authorisation application and regulation,Marketing
"I will prepare business plan  for investors,Marketing
I will call real estate leads and set appointments,Marketing
I will do telegram crypto investment bot,Technology
"I will mix and master your house,Technology
I will make 3d character modeling for animation and games,Technology
I will launch your etsy store and make it profitable,Marketing
I will create a market research report for any industry or niche,Marketing
"I will be your personal yoga,Lifestyle
I will make a memorable commercial brand video,Technology
I will do the subtitles for your german or english video,Technology
I will perform an unbelievable morgan freeman impression,Lifestyle
I will design investor pitch deck and powerpoint presentation in 1 hour,Marketing
I will give great fashion advice,Lifestyle
I will do professional video editing and post production,Technology
"I will teach you javascript,Technology
"I will create colorful photo slideshow promo video,Technology
I will detect and remove webshells from your web server,Technology
I will create a robust and responsive wordpress website,Technology
I will build google authority backlinks omg and rys stack,Marketing
"I will build music website for music artist ,Technology
I will produce and provide audiobook narration for your audiobook,Technology
I will make beautiful high quality photo slideshows for you,Technology
I will do android and IOS app development as per requirements,Technology
"I will 3d model,Technology
I will be your life coach,Marketing
I will design authentic learning material for you,Marketing
"I will create a reliable excel invoicing,Technology
I will expert kindle ebook book formatting createspace paperback formatting,Technology
I will create a workout video for you to get fit at home,Lifestyle
I will record pro horn section for you,Technology
I will create online video course for any platform,Technology
I will hi I am a music engineer,Technology
I will teach music theory for songwriters and composers,Technology
I will create sexy silhouette dance for any music,Technology
I will provide authentic asian cuisine recipes and baking tips,Lifestyle
I will write a patent for your invention,Marketing
"I will do project management,Marketing
I will develop functional wordpress membership site,Technology
"I will edit your trailers,Technology
"I will produce podcast intro,Technology
I will be your actress and do anything you want,Lifestyle
I will online violin lessons for all levels,Technology
I will cast obsession love psychic spell for you,Lifestyle
I will record a conversational american voice over that makes an impact,Technology
I will create pro piano arrangements and compositions in all styles,Technology
I will professionally produce your audio book,Technology
"I will do 3d character modeling,Technology
I will do professional video editing,Technology
I will record saxophone with emotive solos or punchy sax hooks,Technology
I will drive organic crypto traffic visitors,Marketing
I will create kids origami and papercraft youtube video,Lifestyle
"I will create happy birthday slideshow video photo slideshow in 3d,Technology
I will be your wordpress shopify  woocommerce virtual assistant,Marketing
I will professional advertising videos of your product,Technology
I will prepare your USA individual and business tax returns,Marketing
I will convert your web design to html and css,Technology
"I will do vfx,Technology
I will apply new 2020 super circle local SEO technique,Marketing
I will do youtube intro outro video trailer promo or animated logo,Technology
I will ghost produce you an edm song like spinnin records,Technology
I will provide branding services for your startup,Marketing
I will create market research and strategy,Marketing
I will create mysql database schema,Technology
I will do whatever you need related to yogyakarta indonesia,Lifestyle
I will design and develop custom alexa skill,Technology
I will make high quality video trailer promo or teaser,Technology
I will mix professional sfx for your vision or animation,Technology
I will unboxing and demo video product showcase in 4k HD 75 dollars,Technology
I will create most stunning lyrics video for music in kinetic style,Technology
I will record an african american female voice over for you,Technology
"I will typeset,Technology
"I will do market research,Marketing
I will produce short video ads for social media or cinematic trailer,Technology
I will help you with any un job applications and advice on benefits,Marketing
I will activate your kundalini for money and wealth,Lifestyle
I will do professional audio and video editing with sound effects,Technology
I will think of best name for your business brand with logo design,Marketing
I will manage your amazon seller central monthly,Marketing
"I will make your event,Technology
"I will start,Marketing
I will create an outstanding business video for you in 24 hours,Technology
I will provide private songwriting lessons,Technology
I will create a custom yoga or barre class video for you,Lifestyle
I will change all your pictures into sketches or draws,Lifestyle
"I will fully setup your twitch,Technology
I will build and design a responsive website and host it for free,Technology
I will do literally anything in sccm intune and microsoft365 ems,Technology
I will do 350 google maps citations for local business SEO,Marketing
I will design and develop fillable PDF form,Technology
I will write your amazing professional business bio,Marketing
I will make a photo slideshow for you,Technology
I will provide 3d animation for commercial use,Technology
"I will do classified ad posting on top usa,Marketing
I will record my impersonation of donald trump,Lifestyle
"I will create 2d 3d animation,Technology
I will do all type of networking tasks and reports,Technology
I will create a playful mobile app promo video,Technology
I will be your personal acting and public speaking coach,Lifestyle
"I will write,Technology
"I will setup the perfect discord server for growth and success,Technology
I will record drums for your song,Technology
I will research instagram influencers for your brand,Marketing
"I will narrate,Technology
I will create style boards or be your personal stylist,Lifestyle
I will rank your business with local citations up to 500 directories,Marketing
I will teach you how to paint miniatures,Lifestyle
I will build and fix your funnel using clickfunnels,Technology
I will edit your audio on adobe audition,Technology
I will tutor you in math or other subjects,Lifestyle
I will convert your blog post or article into slideshow video with voice over,Technology
"I will convert article,Technology
I will do real estate skip tracing in bulk,Marketing
I will create professional creative content for social media,Technology
I will make a digital copy of your handwritten music,Technology
I will showcase video of geometry dash level,Technology
Our studio will create custom kids song for children,Technology
"I will clean,Technology
I will make a cute or cool bumper video,Technology
"I will develop an ios,Technology
I will do vfx compositing for your shots,Technology
I will provide you epic twitch stream package,Technology
I will create subtitles for your light japanese video,Technology
"I will shoutout you on my 3,Lifestyle
"Our studio will record amazing russian,Technology
I will convert green screen video into transparent gif,Technology
"I will create detailed,Technology
I will create a video for your ecomm or amazon store,Technology
I will teach and coach you to pass your psm and csm certification,Technology
I will do unity game development and prototyping,Technology
I will create online video course for any platform,Technology
I will write the story of your brand,Marketing
I will create and format excel spreadsheet or google sheets,Marketing
"I will write business plan,Marketing
I will write a song to promote your business,Technology
I will be your professional video spokesperson,Technology
I will buy products in malaysia and ship to you,Lifestyle
I will audit your manychat and shopify store chatbot and flows,Technology
"I will write a song,Technology
I will make top quality product rendering,Technology
I will transcribe music or proofread,Technology
I will paint any picture in watercolors by hand,Lifestyle
I will provide professional video color correction and editing,Technology
"I will post your ads on top usa,Marketing
I will do classified ad posting in top classified sites,Marketing
I will create a stylish mobile app promo video,Technology
I will teach you music production and sound engineering,Technology
"I will provide 100,Marketing
I will add a video to your amazon listing to increase your sales,Marketing
I will post your ads on top classified sites manually,Marketing
I will do a perfect screencast software or website tutorial,Technology
I will prepare gantt charts and project schedule on ms project,Marketing
"I will develop a webflow website from figma,Technology
I will add perfectly synced subtitles or captions to your video,Technology
I will add upload amazon videos to listings to boost sales,Marketing
I will print your logo tshirt design photo or illustration as stickers,Lifestyle
I will be your male singer and songwriter,Technology
"I will build a mobile app for ios,Technology
I will teach you to cook jamaican food and microwave easy recipes,Lifestyle
"I will do organic,Marketing
I will edit and master 1hr of your audiobook to pass acx standard,Technology
I will create a shopify one product dropshipping store,Marketing
I will be your personal stylist and image consultant,Lifestyle
I will create a custom logo animation intro and or outro,Technology
I will do facebook ads lead generation for real estate,Marketing
I will do testing and review website as qa on all platforms,Technology
I will create a complete audio ad for you,Technology
I will do targeted lead generation,Marketing
"I will compose and produce amazing,Technology
I will teach you basic digital drawing tips,Lifestyle
I will professionally setup your obs or streamlabs for cheap,Technology
I will make book promo trailer 3d video,Technology
I will photograph your lifestyle campaign in NYC,Technology
I will make a personalized batman birthday video or batman promo video,Lifestyle
I will make a charming animated promo book trailer,Technology
I will design animated stream packages for gamers,Technology
"I will create you custom stream alerts,Technology
I will duo ranked with you in league of legends na euw eune,Lifestyle
I will help you on runescape,Lifestyle
I will fill up US irs tax forms and ppp loan application,Marketing
"I will post 200 classified ads in the USA,Marketing
I will do a healing session with you and an archangel,Lifestyle
I will write on human resource management in 24 hours,Marketing
I will build the twilio sms bot or bulk SMS or voice calls,Technology
I will have 20 users perform test your website and provide feedback,Technology
I will do ios app development and design,Technology
I will create educational or lecture explainer video for any course,Technology
I will create an amazing intro music for your podcast or videos,Technology
I will create apps using google sheets and forms,Technology
I will record 5 urban american dj drops,Technology
I will produce a promo style commercial video,Technology
I will do promo video and photo slideshow,Technology
I will migrate your website to google cloud,Technology
I will create a professional whiteboard animation that converts,Technology
I will create a unique youtube intro,Technology
I will setup cwp plesk zpanel direct admin isp config,Technology
I will write business and human resource management research reports,Marketing
"I will convert article,Technology
"I will edit,Technology
I will create animated marketing video for business and sales,Technology
"I will shoot professional product photography for website,Technology
I will make you an ad spot audio for your product or company,Technology
I will create wix website design or redesign wix website professionally,Technology
I will create full automated aliexpress dropshipping store,Technology
I will help you buy something online from indonesia,Lifestyle
"I will create,Technology
"I will record and master professional female audio ad,Technology
"I will vibe,Lifestyle
I will edit a video game trailer exclusively,Technology
"I will do responsive front end web development in react,Technology
I will do any machine learning task in python,Technology
I will make you a three course swahili menu with the recipes,Lifestyle
I will do professional video editing,Technology
I will film a unboxing or a stunning commercial brand video,Technology
I will create and record your song on video with 2 puppets,Technology
I will get your ex back and tell your fortune,Lifestyle
I will sing a custom reggae dubplate song for dj or brand etc,Technology
I will make a 360 virtual tour for your listing,Technology
I will develop professional elearning courses,Technology
I will create game trailer or app promo video,Technology
I will create a custom sample pack for you,Technology
I will photograph parent and child models advertising your product,Lifestyle
"I will be your best sourcing agent in china,Marketing
I will shopify SEO 1st page ranking on google guaranteed,Marketing
I will format your ebook and print book for self publishing,Technology
I will set up an asana workspace for your business,Marketing
I will create a product unboxing and demonstration video,Technology
I will create amazing real estate promo video,Technology
I will do quality market research and analysis,Marketing
I will design a responsive and professional wordpress website,Technology
I will be your power bi reporting expert,Technology
I will create you an inexpensive yet premium quality discord bot,Technology
I will drive real country targeted low bounce rate traffic for 30 days,Marketing
I will find expired domain with a backlink from da 90 site for 301 redirect,Marketing
I will make unity endless runner game like templerun for you,Technology
I will do real estate lead generation using facebook ads,Marketing
I will design and develop android and ios mobile application,Technology
I will create custom GIF animation for your website icon,Technology
I will do 3d character animation,Technology
I will record HD screencast instructional tutorial explainer video,Technology
"I will do market research,Marketing
