I will build automated and insightful power bi report,Technology
I will get kermit to personalize a video birthday greeting and song,Lifestyle
I will build or redesign your existing squarespace website,Technology
I will create original eastern food cooking video recipe,Lifestyle
I will do local SEO for your website,Marketing
I will design and redesign wix website,Technology
I will record my impersonation sebastion maniscalco,Lifestyle
"I will create amazing photo,Technology
"I will convert PDF to word,Technology
I will cast king lucifer obsession lust spell to make exback fast,Lifestyle
I will be your personal stylist,Lifestyle
I will edit your online course video,Technology
I will produce unique recipes with food photography,Technology
I will professionally do podcast editing,Technology
Our studio will do professional twitch or mixer overlay for your stream,Technology
I will do a screencast instructional or tutorial video in 24 hours,Technology
I will do happy birthday video song with a custom message,Lifestyle
I will user test your website or app,Technology
I will do professional video editing and post production,Technology
I will high quality product photography,Technology
I will do you 5 valuable unique com domain names and complete keyword research report,Marketing
I will be your female model,Lifestyle
I will get amazon a plus content on your amazon listing,Marketing
I will say anything you want in a batman impression with video,Lifestyle
I will create a youtube top 10 list video,Technology
I will make greeting video from donald trump for happy birthday or any holiday event,Lifestyle
I will send quality USA and eu traffic from 5k,Marketing
"I will animated GIF icon or banner for your website,Technology
I will render architectural realistic animation on lumion 10,Technology
"I will business plans for loan,Marketing
I will made your own game trailer in game engines,Technology
I will give you 2020 verified cell number leads from USA,Marketing
I will build web or mobile app in bubble or fix yours,Technology
"I will provide music law and entertainment law,Marketing
I will assist in human resource management tasks,Marketing
I will program you a discord bot,Technology
I will send exciting chinese keto recipes with pictures,Lifestyle
I will test website and assure quality plus project management task,Marketing
I will make dj drops intros radio sweepers and jingles,Technology
I will mix and master your rock metal pop song,Technology
I will promote on my 830k tiktok account,Marketing
I will drive organic web traffic,Marketing
I will help perfect your interviewing skills,Marketing
I will do research on one person,Lifestyle
I will cast a business psychic spell to increase your sales,Lifestyle
I will create a VR game for you with unity and awesome tools,Technology
"I will convert your article,Technology
I will cast an extreme focus spell on you to pass any exam or test,Lifestyle
I will create a stunning google data studio dashboard for you,Technology
I will provide choreography for your song,Lifestyle
I will build positive online reputation management,Marketing
I will give you a graceful chinese name,Lifestyle
I will make an amazing HTML5 web video game,Technology
I will make HD screencast how to use website or app video,Technology
I will record turkish baglama saz for your project or song,Technology
"I will develop windows,Technology
I will create a modern facebook video ad for your business,Technology
I will create video for your blog post and you tube channel using lumen5,Technology
I will create your online course with well researched content,Lifestyle
I will provide you pitch correction and vocal tuning service,Technology
I will add special or visual effects on video,Technology
I will design a custom made paper model with your logo on it,Lifestyle
I will do a cinematic book trailer for your fiction book,Technology
I will ebook formatting kindle paperback book formatting kdp,Technology
I will make you amazing hollywood intro style,Technology
I will give u the ebook fitness and exercise plus 50 articles plus website and license,Lifestyle
I will edit and make your podcast sound great,Technology
I will do penetration testing of a website or web applications with detail report,Technology
I will create inventory for amazon fba shipment and shipping plan over 200 limit US UK,Marketing
I will create you a unboxing stop motion product video,Technology
I will create HD book trailer,Technology
I will produce beautiful product photography for your brand,Technology
I will design an entire branding kit for your business,Marketing
I will develop a web app using react js,Technology
I will produce an apple style interview video,Technology
I will be your costa rican website spokesperson in HD,Technology
I will record and edit french pro voice over,Technology
I will do fun and viral challenges,Lifestyle
I will make 8 we buy houses real estate promo videos,Technology
I will create custom professional orchestral or classical music,Technology
I will create video course for udemy online learning,Technology
"I will code sql,Technology
I will create a custom professional 3d logo animation,Technology
I will make a real estate cinematic video commercial,Technology
I will create automation test for your web and mobile app,Technology
I will screen record and how to use website or app video,Technology
"I will produce,Technology
I will make this awesome gaming or movie teaser trailer,Technology
I will create cinematic unboxing video,Technology
I will teach you all about violin,Technology
"I will voiceover,Technology
I will create craft video for you,Lifestyle
Our studio will professionally mix and master your album,Technology
I will build you a shopify website for your,Technology
"I will design ui ux  for mobile app,Technology
"I will do voice editing,Technology
I will making jingles for radio stations,Technology
I will intermittent fasting ebook and videos,Lifestyle
I will help you plan a travel itinerary for romania,Lifestyle
I will record a john travolta impersonation,Lifestyle
"I will be your male singer songwriter with vocals,Technology
"I will create intro,Technology
I will shoot lifestyle photography for your ecommerce brand in southern california,Technology
I will distribute 25 flyers in high traffic dc areas,Marketing
I will create a step by step video of handmade jewelry,Technology
"I will create a product description video,Technology
I will completely setup your podcast,Technology
I will be ready as your virtual assistant to take care of your data as your demands,Marketing
I will create stunning live action promo video,Technology
I will be your fashion counselor,Lifestyle
I will cold call hundreds of leads to produce sales and growth,Marketing
I will search domain name worth more then 1200usd,Marketing
I will work out your game theory and microeconomics problems,Lifestyle
I will make an amazing music video for your song in 24 hours,Technology
I will create 2d animated gifs in my very exclusive style,Technology
"I will be your amazon virtual assistant,Marketing
I will create an ecommerce android and ios mobile app,Technology
I will create an animated lyric video for your song,Technology
I will provide expert UK visa and immigration advice,Marketing
I will post your ads on 20 high ranked classified sites with proof,Marketing
"I will create 3d iphone,Technology
I will do real estate video editing in 24 hours,Technology
"Our studio will create a full 3d game includes art,Technology
I will map citations with geotagged images no1 local SEO rank,Marketing
I will develop a quality hubspot cms template,Technology
I will craft a value proposition for your product or service,Marketing
I will make a short animation,Technology
I will create or modify professional microsoft access database,Technology
I will transcribe or arrange to a musical score any music,Technology
I will suggest amazing business name and seo friendly domain name,Marketing
I will paint your tabletop and wargame miniatures,Lifestyle
I will play sea of thieves and help you get to pirate legend,Lifestyle
I will create learning videos for kids,Technology
I will provide advice and strategic life coaching,Lifestyle
I will do professional sounding dj drops saying anything you want,Technology
I will coach your next public speaking gig,Marketing
I will add graphics and text or caption animation in your video,Technology
I will make your vocal recordings shine through,Technology
I will be your pop and edm female vocalist and songwriter,Technology
I will produce pop lofi trap beats for you,Technology
I will test your IOS and android games or apps,Technology
I will help in india and new delhi,Lifestyle
I will teach your child how to make a bubble machine,Lifestyle
I will make wordpress woocommerce store or shopify store for you,Technology
I will do podcast editing today,Technology
"I will make abc,Technology
"I will develop java,Technology
I will help you build and administrate your salesforce,Technology
I will do cold calling and appointment setting for you,Marketing
I will write creative lyrics to your music,Technology
I will make an excellent screencasting tutorial video for you,Technology
I will do market research on any topic and industry,Marketing
I will do a dance for you,Lifestyle
I will design and build your professional email signature,Technology
I will create a professional dance video for your song,Lifestyle
I will find private label product that sells hot on amazon fba,Marketing
I will create 2d and 3d animations for children,Technology
I will create 3d product modeling and animation,Technology
I will do advanced pentest on your website with report,Technology
I will create your next intro and outro,Technology
I will ghost produce radio ready music for you,Technology
I will create any food 4k video recipe for you,Technology
I will create custom 3d grunge and metal logo and intro animation,Technology
"I will develop any type of credit risk,Marketing
I will be online course creator or training video with voice over,Technology
I will create ideal buyer persona,Marketing
I will create modern business presentation video intro promo,Technology
I will do kindle ebook book formatting amazon kdp paperback,Technology
I will produce your elearning or education video,Technology
I will be your android app developer or develop your android app,Technology
I will provide you targeted numbers for SMS or whatsapp marketing,Marketing
I will 15 sec food advertising video,Technology
"I will research your family tree,Lifestyle
"I will put your lyrics to music,Technology
I will give professional violin lessons online,Technology
I will upload products to your shopify store,Technology
I will send keyword targeted usa and uk organic traffic with low bounce rate,Marketing
"I will professionally QA test your site,Technology
"I will track live drums,Technology
Our studio will produce professional custom explainer video,Technology
I will create a complete brand guide for your business or service,Marketing
I will provide insightful comprehensive market research,Marketing
I will design a high end wix website for you,Technology
I will setup google adwords search ads for top ranking,Marketing
I will do any matlab c cpp java python programming electrical engineering projects task,Technology
I will do custom 3d intros or outro your youtube channel,Technology
I will do a star studded birthday video ecard,Lifestyle
"I will ghostwrite a hit hip hop,Technology
I will do ebook formatting paperback formatting for amazon kindle,Technology
I will shoutout you to 700k instagram fashion or music pages,Marketing
I will present your product I am a former national tv host,Technology
I will do professional video editing for you,Technology
I will create an awesome whiteboard animation video,Technology
I will voice your radio or TV commercial voice over,Technology
I will create a professional video for your cocktail,Technology
I will create video trailer for your games or apps,Technology
I will do mailchimp sales funnel for your shopify and ecommerce store to boost sale,Marketing
I will film a branded office spokesperson video in HD or 4k,Technology
I will do unboxing video of your product,Technology
I will animate anything you want,Technology
I will do manual and automation testing,Technology
I will sing your rock and metal songs,Technology
"I will animate your photos,Technology
I will test your website and give feedback,Technology
I will photograph your event in new york city,Technology
I will create your podcast theme song,Technology
I will make a promotional video for your company excellent quality,Technology
I will convert psd to responsive html css and bootstrap,Technology
I will create pro spokesperson demo video using your product,Technology
I will do your project management task,Marketing
I will audit your ecommerce site or app and suggest UX improvements,Technology
"I will setup your software for streaming obs,Technology
I will give you the best forex trading system,Marketing
"I will do business valuation,Marketing
I will send your message to space,Lifestyle
I will create a promotional photo or video slideshow,Technology
I will submit ingenious business brand name domain with logo design,Marketing
"I will do professional business plan,Marketing
I will create a video from your power point or PDF,Technology
I will record vocals for your music,Technology
I will manually convert your 300 page document to kindle format and formatting,Technology
I will obtain certified italian genealogy records,Lifestyle
I will do genealogy research of your ancestors,Lifestyle
I will do web designing and development with laravel,Technology
I will promote your music professionally,Marketing
I will create you a custom song or jingle in 48 hours or less,Technology
I will teach you to make money online,Marketing
I will create custom twitch or youtube stinger transitions for you,Technology
I will create a custom 2d animation or cartoon explainer video,Technology
I will create a high impact intro or outro for you,Technology
I will be your singer songwriter,Technology
I will be your personal fashion stylist and wardrobe shopping guide,Lifestyle
I will give you over 400 Secret Franchise Recipes,Lifestyle
I will do a professional logo animation,Technology
I will create a stunning brand name and a proper brand positioning,Marketing
"I will test websites,Technology
I will do a professional photo slideshow,Technology
"I will manually tune,Technology
I will create epic recipe videos for you,Lifestyle
I will add dutch or english subtitles to your video,Technology
I will make a viral video of what you want,Lifestyle
I will do live personal training sessions with skype facetime etc,Lifestyle
I will say anything you want in a video,Lifestyle
I will create an dynamic real estate  video editing that convert,Technology
Our studio will create awe inspiring instagram video ads,Technology
I will make you a beautiful printable wall art,Lifestyle
I will create a custom app explainer video or app demo video ads,Technology
I will create a family tree to your liking,Lifestyle
"I will provide you Business Leads,Marketing
I will create powerful live action commercial or business promo video,Technology
I will promote and market your flippa auction on social media to be more active,Marketing
"I will do 50 high da yext,Marketing
I will draft your patent application,Marketing
I will do all sorts of special visual effects in after effects vfx,Technology
I will create professional custom lyric videos in any style,Technology
I will create converting business commercial video,Technology
I will perform love and attraction spell,Lifestyle
I will say anything you want as a doctor in a video,Lifestyle
I will do full google map plan to outrank local competitors,Marketing
I will answer any questions you have about tunisia,Lifestyle
"I will test and review website,Technology
I will google my business gmb listing bulk verification,Marketing
I will be your personal shopper and stylist,Lifestyle
I will do reggae dancehall dj drops,Technology
I will find the HD pictures of any artist paintings,Lifestyle
I will add visual effects in your video using after effects,Technology
I will create an amazing short video for your  business or project,Technology
I will record a professional voice over in 24hrs or less,Technology
I will make screen recording with video editing,Technology
I will teach you all the secrets of tango music,Technology
I will place your logo design on products clothes and more 2 hours,Lifestyle
I will get Celebrities for hold sign that looks Realistic,Lifestyle
"I will create an unboxing,Technology
I will create wordpress website design or blog,Technology
I will help you to sell domain name with listing and landing page,Marketing
I will build and paint warhammer miniatures,Lifestyle
"I will do 145 directory citations for usa,Marketing
"I will research your ancestry,Lifestyle
I will make origami DIY paper crafts videos for youtube facebook,Lifestyle
I will create unique animated gif,Technology
I will make you an awesome website,Technology
"I will build python scripts do web scraping,Technology
I will make an animated lottie json for web or app based on your source,Technology
"I will create stylish custom app promotion video,Technology
"I will create cinematic trailer,Technology
I will provide mca bank statement and app,Marketing
I will create a professional spokesperson puppet video in english or in spanish,Lifestyle
I will make viral games and funny videos,Lifestyle
I will be your wordpress website designer and developer,Technology
I will design a kickass proposal and pitch deck in just a few hours,Marketing
I will model and photoshoot for your brand,Technology
I will professionally edit and format powerpoint presentations,Marketing
I will penetration test your website with professional report,Technology
I will help with undergraduate mathematics,Lifestyle
I will create a manychat bot for your amazon business on facebook,Technology
I will create complete ecommerce website online store,Technology
I will cast a psychic powerful and permanent love spell to bring your ex back,Lifestyle
I will conduct online yoga classes,Lifestyle
I will video a unboxing product or a product demo,Technology
I will film an HD breaking news video,Technology
I will provide cybersecurity and devops services,Technology
"I will do microsoft excel macro,Technology
I will cast the retrieve a lover spell,Lifestyle
I will submit your songs to record labels,Marketing
I will develop a andriod mobile 2d and 3d game,Technology
I will master your music using world class outboard gear,Technology
I will drive low bounce traffic with 3 minutes visit duration,Marketing
I will create smart form using formstack,Marketing
I will make marketing videos that inspire,Technology
I will build an add on for your wix site with wix code corvid,Technology
I will add sound effects and background music to your project,Technology
I will do ios app development and design,Technology
I will cast a potent job hunting psychic spell for you,Marketing
I will test your business idea with an experiment,Marketing
I will cold call to skyrocket your appointments,Marketing
I will offer you a comprehensive project management service,Marketing
I will unbox your product and try it in a video,Technology
"I will develop squarespace website,Technology
I will paint your tabletop minis,Lifestyle
I will promote your products on my instagram or youtube page,Marketing
"I will professionally design flyers,Marketing
I will help you market your app via google and facebook,Marketing
I will teach you how to do any origami,Lifestyle
I will test and review with UX audit your website or app,Technology
"I will teach you wordpress,Technology
I will edit or design a responsive website for your business,Technology
I will produce a male narration voice for your audiobook,Technology
I will create video trailer for the game,Technology
I will design professional workshops and training courses,Marketing
I will create ann thread on bitcointalk for blockchain or cryptocurrency project,Marketing
I will teach or help you to make music in logic pro x,Technology
"I will do kindle,Technology
"I will do market analysis,Marketing
"I will create one product shopify dropshipping store,Technology
I will submit your single to top 165 most popular playlist curators on spotify,Marketing
I will design your logo or text on celebrity t shirts,Lifestyle
I will design your report or guidebook or similar docs,Marketing
I will create personalized hogwarts acceptance letter,Lifestyle
I will make dog searching shopify video ads,Lifestyle
I will make videos of challenges and fun together with my friends,Lifestyle
I will record dj drops deep male voice,Technology
I will create high quality vfx for you at an affordable price,Technology
I will create an app promo video,Technology
"I will provide accounting,Marketing
I will make a customized workout plan for your needs,Lifestyle
"I will do web,Technology
I will produce your authentic reggae and dancehall tracks,Technology
I will teach you martial arts and full body flexibility,Lifestyle
I will custom design great sounding sound effects,Technology
I will record a professional male voice over today,Technology
I will rank website with organic seo keyword targeted USA web traffic,Marketing
"I will create eye catching 2,Technology
I will develop or customize oracle application with oracle database,Technology
"I will create arma or dayz cinematics,Technology
I will do your family tree genealogy research,Lifestyle
I will give you tax delinquent leads in your target counties,Marketing
I will make comprehensive market research competitor analysis business plan report,Marketing
I will remix any song in any style,Technology
I will convert your lessons to video files,Technology
I will transcribe any music audio to sheet music or score,Technology
I will do product photography with models included,Technology
I will help you build a digital music promotion strategy,Marketing
I will produce an original intro to your podcast,Technology
I will create alexa skill for your podcast,Technology
"I will color correct,Technology
I will convert your blogs and articles into an engaging video,Technology
I will create facebook messenger chatbot whatsapp chatbot and website bot,Technology
I will test the security and vulnerability of your site,Technology
I will photograph professional headshot for you,Technology
I will create a modern revamp of a recipe of your choice,Lifestyle
I will create your  cybersecurity awareness program,Technology
I will create character animation video for kids education,Technology
I will take product photography on the beaches of malibu,Technology
I will answer your any questions about south korea,Lifestyle
I will be the only voice over artist you ever need,Technology
I will deliver a nice package with original binaural beats music for relax meditation,Lifestyle
I will sing or create you a perfect jingle,Technology
I will create a workout video,Lifestyle
I will develop a high quality hybrid app using react native,Technology
I will draw wsj style engraving,Lifestyle
"I will produce dj drops,Technology
I will develop an engaging and interactive elearning course using articulate storyline,Marketing
I will model and I will make you laugh,Lifestyle
I will make any presentation ppt,Marketing
I will send HD pictures of paintings from world famous museums,Lifestyle
"I will edit,Technology
I will cold call your b2b prospects,Marketing
I will professionally remove vocals and isolate music of any audio,Technology
"I will make chatbot for facebook messenger,Technology
I will build and design your wordpress website,Technology
I will make you a personalized video message from a princess,Lifestyle
I will provide you with data protection and privacy services,Technology
I will subtitle videos from english to italian and vice versa,Technology
"I will make subtitle on english or serbian,Technology
I will increase domain rating DR ahrefs 60 plus,Marketing
I will create a outstanding app promo video for ios or android,Technology
I will develop custom cms for your website,Technology
I will be the reader of your book in italian verison,Technology
I will create 3 awesome stinger transition for obs twitch youtube,Technology
I will design and develop a modern professional website,Technology
I will create 20 fire logo animation or youtube intro video,Lifestyle
I will professionally add chinese subtitles captions to video,Technology
I will create project plans and management documents like charter etc,Marketing
I will get you funding with a compelling presentation,Marketing
I will do hand portrait painting on canvas in my style,Lifestyle
I will be app developer and android app designer,Technology
I will draw a detailed sketch of a house or building,Lifestyle
I will research your ancestry and trace your family tree,Lifestyle
I will do website design and development,Technology
I will create slick looping animations as gifs or videos,Technology
I will create a converting video ad for facebook youtube instagram,Technology
I will offer highly ethical psychic readings,Lifestyle
"I will create an animated explainer video,Technology
I will place your logo or image on multiple objects,Lifestyle
I will create a charismatic and custom logo animation,Technology
I will write an astrology article for your blog or website,Lifestyle
I will cast a fast working obsession spell,Lifestyle
I will make cartoon and anime animation,Technology
I will teach you big data science in r,Technology
"I will make professional  promo,Technology
I will produce quality cinematic videos for your products and brand,Technology
"I will provide big data solutions with spark,Technology
I will produce a cinematic book trailer,Technology
I will create an eye catching  brand commercial video,Technology
I will teach you music theory,Technology
