"I will record custom sexy female dry voice tag line,Technology
I will make a DIY room decor craft idea tutorial videos,Lifestyle
I will create customized promo video for your mobile or web app,Technology
I will be you pro edm ghost producer,Technology
"I will create,Marketing
I will be the model of your videos,Lifestyle
I will create amazing original music and sounds for your game or film,Technology
"I will teach you PHP with mysql and c,Technology
I will edit your video game trailer or mobile game ad promo,Technology
I will do 301 redirect expired domain backlinks from da 90 site,Marketing
"I will remove energy blocks,Lifestyle
I will record 6 male  dj drops,Technology
I will be your dancing girl,Lifestyle
I will create an amazing book trailer video,Technology
I will create a female voice tag,Technology
I will create short product video,Technology
I will record an impersonation of tony soprano,Lifestyle
I will do an amazing book trailer,Technology
"I will create a manychat bot on your facebook page,Technology
I will write employee handbook HR policies and kpis,Marketing
I will create amazing stinger transition for you,Technology
I will write sing and produce your jingle or theme song,Technology
I will coach you in valorant,Lifestyle
I will help you set up obs on twitch or youtube,Technology
"I will create realistic architectural animation,Technology
I will provide a list of over 125 fashion boutique wholesalers,Marketing
I will provide probates and pre probate leads for total USA state,Marketing
I will edit your podcast and make it sound amazing,Technology
I will make we buy houses for cash real estate explainer video,Technology
I will cast powerful love spell commitment,Lifestyle
I will create beauty intro for youtube with illustration,Technology
I will create captivating squarespace website,Technology
I will test your website and provide user feedback,Technology
"I will do a 2d cartoon music video,Technology
"I will send a postcard from sardinia,Lifestyle
I will do a powerful celebrity voice over,Lifestyle
I will create dynamic photo slideshow video or promo slideshow video,Technology
"I will any databases mysql,Technology
"I will create social media,Technology
"I will record,Technology
I will do high quality custom intro and or outro,Technology
I will produce a the intro music for a podcast or radio show,Technology
I will make a powerful explainer video or promotional video,Technology
I will test your video game,Technology
I will create a book video trailer,Technology
I will create a pro earning android app,Technology
I will offer online lockdown piano lessons,Technology
I will help you with data analysis and six sigma projects,Technology
I will create cooking video for you and give recipes,Lifestyle
I will be your online personal trainer,Lifestyle
I will optimize your gmb listings in snack pack for local seo,Marketing
"I will design online banner,Marketing
I will be your professional unity3d software engineer,Technology
"I will do data entry,Marketing
I will send your bulk sms campaign,Marketing
I will contact and negotiate with social media influencer,Marketing
I will provide call of duty mobile game play videos,Technology
I will edit and mix the sound of your film and video,Technology
I will be your female rapper  songwriter for your song,Technology
I will create your jingle or theme song,Technology
I will provide a detailed etsy shop critique,Marketing
I will record professional IVR in english,Technology
I will find your italian ancestry,Lifestyle
I will paint your tabletop miniatures,Lifestyle
I will be your professional voice actor,Technology
I will create custom intro and outro for youtube and instagram,Technology
I will make pay stubs and payroll documents,Marketing
"I will create fascinating twitch logo,Technology
I will create weekly or seasonal outfit blueprints,Lifestyle
I will do up to 200 UK directories to boost seo ranking,Marketing
"I will do watercolor painting,Lifestyle
"I will do certifiable mobile app promotion,Marketing
I will provide online singing lessons and vocal coaching with fun,Technology
I will make you a trippy drippy animated video,Technology
I will create premium business name brand name with logo design for your branding,Marketing
I will configure and fix magento error and issues,Technology
I will create video course for udemy,Technology
I will do 3d promotional video for your product or services,Technology
I will make your animated explainer video,Technology
I will give my first baby ebook with plr,Lifestyle
I will cast an amazing custom spell using powerful jinn spirits,Lifestyle
I will do live action product explainer marketing video,Technology
I will teach online music theory lessons,Technology
I will develop your startup pitch deck,Marketing
I will produce dj drops radio sweepers and radio jingles,Technology
I will assist in human resource management tasks,Marketing
I will convert your book to epub,Technology
I will create educational learning 2d animation video for kids,Technology
I will create an intro or a short logo animation,Technology
"I will provide you 100k,Marketing
I will grabar una voz femenina en espaol latinoamericana,Technology
"I will code for thinkorswim,Technology
"I will design shopify store,Technology
I will coach you to get 150 points insane credit repair,Marketing
I will create best google local SEO strategy to dominate your niche,Marketing
I will create a premium theme shopify web store site,Technology
I will distribute your music press release to genre specific sites,Marketing
I will buy a domain with hosting and unlimited email for 1 year,Marketing
I will make a real estate video rent vs buy,Technology
I will transcribe your audio file to sheet music for any instrument,Technology
I will provide professional videography in los angeles,Technology
I will be your HR consultant with more than ten years experience,Marketing
I will create a smart chat bot for your home page,Technology
I will write a patent application,Marketing
I will create a family tree,Lifestyle
I will write lyrics for rap or hip hop and edm music,Technology
I will edit PDF and create fillable PDF form,Technology
I will make the live action or cgi animated video for you,Technology
I will create monetization funny videos for youtube and facebook page,Lifestyle
I will send targeted SEO web traffic by search engines for 1 month,Marketing
I will convert psd to html,Technology
I will create a glam guide for you,Lifestyle
"I will make business product video commercial ads,Technology
"I will setup obs settings for streaming,Technology
"I will create online video course for udemy,Technology
I will produce a german podcast intro and outro,Technology
"I will provide you tax and sba,Marketing
I will promote your ecommerce site for more sales and revenue,Marketing
I will create app explainer video or app promo video for marketing or sales,Technology
I will convert article to video with voice over,Technology
I will create a cinematic book trailer,Technology
"I will do kindle formatting,Technology
I will film a commercial with live actors for your product or brand,Technology
I will make aladdin wish happy birthday or sing in 24 hours,Lifestyle
I will make you an edited video in gta 5,Technology
I will coach you for a business analyst interview,Marketing
I will do software quality assurance,Technology
I will transcribe and add subtitles or captions to a video in 24 hrs,Technology
I will do a real estate shoot for you in london,Technology
I will provide professional rocket league coaching,Lifestyle
I will make world class music video in 4k resolution,Technology
I will read your akashic records to answer 2 questions any subject,Lifestyle
I will edit and master your podcast,Technology
I will architecture 3d animation for your design,Technology
I will record acoustic guitar for your song,Technology
I will dance african urban styles,Lifestyle
I will be your personal stylist and wardrobe consultant,Lifestyle
"I will be your VA for data entry,Marketing
I will coach you in guideline tetris,Lifestyle
I will create animated bits or cheers alert for twitch,Technology
I will produce a fully customized app explainer video,Technology
I will create animated 2d explainer video,Technology
I will get your business gdpr compliant,Technology
I will do exclusive viral music promotion,Marketing
I will give you high profit making forex robot,Marketing
"I will convert blogs,Technology
I will produce dj drops with your voice over,Technology
I will create a professional motion tracking,Technology
I will make you a personalized game show video with a puppet,Lifestyle
"I will 14,Marketing
I will prepare your individual or business income taxes for you,Marketing
I will be your executive virtual assistant and project manager,Marketing
I will build an ocr tool with google cloud vision,Technology
I will be your project  manager and business analyst,Marketing
"I will finish your song,Technology
I will produce your instrumental track of any genre,Technology
I will create business wordpress website design,Technology
I will development of copyright patterns for cross stitch,Lifestyle
I will design an interactive fillable PDF form,Technology
I will provide high quality data entry solutions,Marketing
I will help you break into product management,Marketing
I will be your fashion model,Lifestyle
I will create a professional corporate video with stock footage,Technology
I will create a custom 2d app explainer video or app promo video,Technology
I will do aso app store optimization and localize to japanese for your app or game,Marketing
I will do video trailer for mobile games or app,Technology
I will do foley and sound design for your film or video,Technology
I will cast a valentines love spell,Lifestyle
I will record your script with a young female voice,Technology
I will create eye catching dropshipping product video,Technology
"I will cooked rice with chickpea,Lifestyle
"I will clean up,Technology
I will create a cartoon 2d video animation for you,Technology
I will buy products in india and ship to you,Lifestyle
I will design a stream transition or stinger for obs,Technology
I will setup and fix your elgato wavelink microphone for recording,Technology
I will edit your podcast in french or english,Technology
"I will shoot and edit your book trailer,Technology
I will create a CEO ready presentation for you,Marketing
I will create a video for your freelance gig,Technology
I will make a professional unboxing video for you,Technology
I will correct bank statements and reconcile bank statements,Marketing
I will create a proffesional gaming intro,Technology
I will create a screencast video for your website or app,Technology
I will actions for google home,Technology
I will be your amazon consultant or mentor amazon fba,Marketing
"I will record violin,Technology
I will cast a 100 year old extreme wishing spell to grant your  wish,Lifestyle
I will send your note to God at western wall  KOTEL,Lifestyle
I will record any dutch male voice over today,Technology
I will clean and recover hard to hear voices in your recordings,Technology
I will create beautiful food video for your social media,Lifestyle
"I will manually tune,Technology
I will shoot and edit high quality video,Technology
"I will play your song on radio new york live,Marketing
"I will format book for kindle kdp,Technology
I will be your real estate cold calling virtual assistant,Marketing
I will create a 3d mobile app explainer video or app promotion,Technology
I will create a professional weebly website for you,Technology
I will paint your miniatures to a table top standard for an affordable price,Lifestyle
I will provide a full job seeker package,Marketing
"I will do vfx clean up,Technology
I will create 150 unique google map citations help your uk business,Marketing
I will make a best DIY videos of art for your social channels,Lifestyle
"I will do data analysis in r,Technology
"I will create cinematic book trailer,Technology
"I will design divi wordpress website,Technology
I will create a custom live animation rig for streaming 2d in adobe character animator,Technology
I will get influencers that are relevant to your business to promote your brand,Marketing
"I will be your music producer,Technology
I will create an amazon product demo lifestyle video,Technology
I will make home made food video and street food video,Lifestyle
"I will do Professional HD video,Technology
I will create a 3d model of a creature or monster of your choice,Technology
I will perform penetration testing on your web application,Technology
I will design your bespoke business reports using jet reports,Marketing
I will make a real estate video for the current 2020 market,Technology
I will make you a custom dj mix with any music you choose,Technology
I will make a catchy jingle or theme song,Technology
I will design a simple 2d explainer video,Technology
I will be your stylist and personal shopper,Lifestyle
I will make viral and funny videos,Lifestyle
"I will buy,Lifestyle
"I will perfectly tune,Technology
I will transcribe your favorite track to midi data,Technology
I will identify and appraise your antique porcelain figurine or porcelain mark,Lifestyle
I will record a pro voiceover in a southern american accent,Technology
I will develop react native mobile app,Technology
"I will forecast 15 perfect business name,Marketing
I will send you five pages of my personal diary,Lifestyle
I will research and write on religion,Lifestyle
"I will professional clean,Technology
I will do high quality web research and market research reports,Marketing
I will create amazing promotional explainer HD video from scratch,Technology
I will train you how to use blender,Lifestyle
I will create the perfect royalty free music intro for your podcast,Technology
I will do aso and write great description for apps or game,Marketing
I will shoot corporate portraits in london,Technology
I will tutor you in artificial intelligence and machine learning,Technology
I will do organic spotify promotion,Marketing
I will draw discord to relationship using powerful magic spell,Lifestyle
I will create a stunning demo video for your mobile app with voice,Technology
I will create custom stickman or 2d character animation,Technology
"I will give 80,Lifestyle
I will create an amazing timelapse or photograph for your pleasure,Technology
I will create animated twitch alert for your channel,Technology
"I will post flyers at uc san diego with 60,Marketing
I will be your rapper for any style song,Technology
I will do 3d product animation,Technology
I will convert article to video with voiceover professionally,Technology
I will rank your website first page on google,Marketing
I will create a professional  animation for your music video,Technology
I will be your life coach and guide,Lifestyle
"I will shoot creative product photography for fashion,Technology
I will make a kinetic typography lyric video,Technology
I will convert your article into a video using lumen5,Technology
I will edit intros and outros for your youtube,Technology
I will create training course and material,Marketing
I will teach you how to produce hardstyle music,Lifestyle
I will make this real estate video we buy houses dogs version,Technology
I will do anything in adobe after effects,Technology
I will file your trademark application in canada,Marketing
I will do the best music transcription,Technology
I will produce amazing music and sounds for your video game,Technology
I will be your IT agile functional business analyst,Marketing
I will provide legal consultation in brazil,Marketing
I will create high quality 2d animation,Technology
I will create professional kids 2d animation for you,Technology
I will create online video course for udemy,Technology
"I will create gantt charts work breakdown structure,Marketing
I will create a science or an educational video,Lifestyle
I will design an outstanding greeting and birthday card in 24hours,Lifestyle
I will drive real targeted web traffic visitors from arab countries,Marketing
"I will design your microsoft access database,Technology
"I will be your best virtual assistant,Marketing
I will create a stunning demo video for your website with voice,Technology
I will create professional product photography images in berlin,Technology
I will perform a UX review of your website,Technology
I will do shopify winning product research for dropshipping,Marketing
I will manage amazon fba private label virtual assistant a to z,Marketing
"I will record,Technology
I will an onscreen website or document presentation,Technology
I will record professional violin and strings sections for you,Technology
I will edit your podcast for a cheap price,Technology
I will transfer a 3 to 9 year aged corp get funding business credit,Marketing
I will add products in your ecommerce website,Marketing
"I will do dialog editing,Technology
"I will create 2d,Technology
I will do QA for your android or ios mobile app,Technology
I will design your wardrobe with your current clothes,Lifestyle
"I will sing,Technology
I will find and fix security vulnerabilities on your server,Technology
I will create a character walking animation,Technology
I will do audio logo sound design for your video intro,Technology
I will write an accurate presentation structure for you,Marketing
I will provide shopify virtual assistant and customer service team for 50 to 999 hours,Marketing
I will transcribe and permanently add captions to your videos,Technology
"I will offer ios dev training,Technology
I will do the best hip hop rap feature or hook on your song,Technology
I will tune or autotune your vocals in a perfect way,Technology
"I will send a real freshwater pearl,Lifestyle
I will create or edit your online dating profile for you,Lifestyle
I will provide any type of AWS services,Technology
I will do 52 south africa da web directory,Marketing
"I will pitchcorrect,Technology
I will increase domain authority da50,Marketing
I will voice an impersonation of jigsaw the famous serial killer,Lifestyle
I will create 2d animated gif with my exclusive styles,Technology
I will create professional acoustic session drummer recordings,Technology
I will make an interactive elearning course,Marketing
I will make a gay happy birthday video,Lifestyle
I will create awesome custom logo animation or intro,Technology
I will print bulk vinyl stickers,Marketing
I will be your aso expert to rank in google play and app store,Marketing
"I will shoutout or promote your music on my 2,Marketing
I will create professional movie or book trailers,Technology
I will build an amazing website,Technology
I will create CSV file and upload products to prestashop wix and many more,Marketing
"I will tune,Technology
I will send keyword targeted true google search traffic,Marketing
I will find SEO friendly domain name for your brand,Marketing
I will tune and repair your vocals to perfection,Technology
"I will investigate suspicious url,Technology
I will produce professional lifestyle images with a child,Technology
"I will translate and add english,Technology
I will create a scenario based model,Marketing
"I will create a whiteboard animation,Technology
I will create an amazing cinematic book trailer,Technology
"I will be your salesforce developer for lightning,Technology
I will create unique twitch stinger transition,Technology
I will be your dog model,Marketing
I will get you business credit and loans without using ssn,Marketing
I will draft and file a trademark application,Marketing
I will help you with china sourcing alibaba 1688 factory search,Marketing
I will convert article script blog  into a  video with voice over,Technology
I will skyrocket your gmb with 1k google map citation for local seo,Marketing
I will be your female vocalist session singer,Technology
I will mix and master your tracks for commercial release,Technology
I will be your personal aesthetic fashion stylist,Lifestyle
I will help you to identify if your account has been compromised,Technology
I will advise and research on anything about africa,Lifestyle
I will do a love reading and channel love messages for you,Lifestyle
I will help you throughout the recruitment process,Marketing
I will perform market research for your app,Marketing
I will buy and send you anything you want from germany,Lifestyle
I will make a commercial or explainer video,Technology
I will attune love attraction power and charisma,Lifestyle
I will add product for shopify etsy woocommerce printify store,Marketing
I will make your high quality animation intro,Technology
I will cold call list of individuals or businesses to generate leads,Marketing
I will create an outstanding app promo video,Technology
"I will do product unboxing,Technology
I will send organic social media traffic,Marketing
I will teach you how to make cute crochet things,Lifestyle
I will cast a fully custom midnight spell casting for you any desire,Lifestyle
"I will voice your self help video,Technology
I will guide you and teach you  how to be a laravel and vue js developer,Technology
"I will outsource,Marketing
I will make happy birthday video from the world leaders,Lifestyle
I will file and prepare design or utility patent,Marketing
I will unbox your product or item on video,Technology
I will compose epic orchestral cinematic music with realistic orchestra sound,Technology
"I will write your company description,Marketing
I will teach yoga online with a focus on alignment,Lifestyle
I will do happy birthday video,Lifestyle
I will create a tik tok dance video to promote your music,Marketing
I will record professional keyboards on your tracks,Technology
"I will model for funny videos,Lifestyle
I will submit your song to music playlists,Marketing
I will write chords that will make you cry,Technology
I will create a professional radio commercial for you,Technology
"I will soundcloud music promo,Marketing
I will design an animated starting ending soon,Technology
"I will do anything for you from monterrey,Lifestyle
I will manually post your ads on USA classified ad posting sites,Marketing
I will solve all your geology and environmental problems,Lifestyle
"I will do software testing,Technology
I will teach you private yoga classes,Lifestyle
I will do any kind of data entry and admin support work,Marketing
I will create shipping plan for amazon fba shipment over 200 units,Marketing
I will brainstorm ranking domains with keywords for your website,Marketing
I will give you challenger coaching in league of legends,Lifestyle
I will compose trance pop and j pop song,Technology
"Our studio will create a complete,Technology
"I will cast ultimate powerful african sangoma obsession,Lifestyle
I will develop unity game and plugins,Technology
I will make a video walkthrough for any game,Technology
"I will do data entry,Marketing
I will collect email from instagram,Marketing
I will voice and produce flawless podcast intro with sfx and music,Technology
I will help you grow your cleaning business,Marketing
I will create HD brand commercial video and promotional video ads,Technology
I will write you an outstanding business plan,Marketing
I will create an amazing 2d animated app or website explainer video,Technology
I will give you vegan recipes or vegan books or vegan video,Lifestyle
I will do amazon product research for fba private label   bonus,Marketing
I will do pro twitch animated overlay and complete stream package,Technology
"I will deliver a great sound design,Technology
I will write a powerful vision and mission statement,Marketing
I will record acoustic drums in a professional way on your project from pop to jazz,Technology
I will do b2b lead generation by using linkedin sales navigator,Marketing
I will play your song over 500 times on our fm radio station,Marketing
I will find winning shopify dropshipping products with video ads,Marketing
I will do your project management tasks and scheduling,Marketing
I will create a cooking video recipe like tasty buzzfeed food,Lifestyle
"I will craft professional twitch logo,Technology
I will teach you software testing tools and techniques,Technology
I will do animation GIF for social media,Technology
I will make ms teams be a phone system for you,Technology
"I will quickly repair,Technology
I will make you an intro or outro song for your youtube videos,Technology
"I will record professionally piano,Technology
I will work on 3d medical animation video,Technology
I will teach you how to make crochet handcrafts with wools,Lifestyle
"I will develop database projects in ms access,Technology
I will make real estate video promo for realtors,Technology
I will provide exclusive final expense leads,Marketing
I will create professional exercise fitness videos,Lifestyle
"I will create an amazing radio ready ad for you,Technology
I will create professional looking HD videos to explain content,Technology
"I will do perfect data entry,Marketing
I will create real estate video for we buy houses for cash theme,Technology
I will create a product advertisement or unboxing video,Technology
I will develop professional elearning module in articulate storyline,Technology
"I will backing measurements in grams,Lifestyle
I will do unity 3d game development and design,Technology
I will full redesign wordpress website,Technology
I will make video course for any platform,Technology
I will produce your radio show or podcast,Technology
I will be your 24 hr personal virtual assistant making  calls etc,Marketing
I will design the highest quality sound effects for your games,Technology
I will find a handpicked killer domain name for your business,Marketing
I will create 3d animation for kids,Technology
I will animate your logo according to your needs,Technology
I will test and apply system hardening on your web server,Technology
I will 3d print your miniatures for you,Lifestyle
I will be your video spokesperson,Technology
I will create kinetic typography video,Technology
"I will place niche edit on my  top performing 700 rd,Lifestyle
