"I will conduct statistical data analysis in r,Technology
I will cause your ex to fall back in love with you telepathic healing,Lifestyle
I will do shopify klaviyo ecommerce email marketing campaign flows,Marketing
I will configure your live streaming,Technology
I will create sheet music of your composition or song,Technology
I will can be your perfect dancer,Lifestyle
I will create subtitles in spanish or english no script needed,Technology
I will indentify game bugs and glitches and will give short review steam and pc,Technology
I will buy anything from the philippines,Lifestyle
I will do a 360 degrees analysis of your competitors,Marketing
I will shoot your property in  southern UK,Technology
I will do book formatting for amazon KDP or other platforms,Technology
I will make 2d animated GIF for you,Technology
"I will do branding,Marketing
I will do 3d product explainer video,Technology
I will create a cooking cocktail video recipe tasty buzzfeed food,Lifestyle
I will do anything for you in the philippines,Lifestyle
I will design beautiful greeting cards for each occasion,Lifestyle
I will 3d animation video and 3d character design,Technology
I will create whiteboard video with my original drawings,Technology
I will create manychat bot for amazon fba,Technology
I will be the perfect male singer for your project,Technology
"I will teach you wordpress website and bug fixing,Technology
"I will transcribe any musical instrument into midi,Technology
I will design a custom logo animation,Technology
"I will setup,Technology
I will find high authority expired domain having moz da 50 plus,Marketing
I will provide customized vinyasa yoga flows,Lifestyle
"I will setup twilio,Technology
I will narrate and master your audiobook for audible with acx compliance,Technology
"I will professional promo ,Technology
I will design your strategic positioning and brand strategy,Marketing
I will write original lyrics for you,Technology
I will approve pesticides devices and restricted  categories on amazon,Marketing
I will help you get better at the piano or learn music theory,Technology
I will design wordpress lms website and learndash lms,Technology
"I will do podcast editing,Technology
I will create fully custom explainer video for you,Technology
I will be your ico advisor for your new cryptocurrency project,Marketing
I will create a fully functional interactive discord bot,Technology
I will provide pre designed online e learning training workshop courses,Marketing
I will make 3d product animation videos,Technology
I will convert your design to HTML,Technology
I will do social media banners,Marketing
I will setup a fully working live streaming,Technology
I will create a professional  screencasting video tutorial for your website or app,Technology
I will make screencast and promo video of web and app,Technology
I will fix all the computer problems that are overwhelming you while working from home,Technology
I will professionally mix and master your song in 24 hrs,Technology
I will record a celebrity impersonation voiceover message,Lifestyle
I will do arabic aso for your mobile app on both of the app stores,Marketing
I will do linkedin b2b lead generation and prospect list building,Marketing
I will teach you to play the violin,Technology
I will do longterm qa and testing of the website,Technology
I will professionally mix and master your song,Technology
I will provide 5 dj drops with your dj name,Technology
I will develop custom django flask python web app and deploy it,Technology
I will copy your pdf or handwritten music on finale,Technology
"I will send you 1g of gacu,Lifestyle
I will send You A System For Your PRODUCTIVITY And Eliminate Procrastination,Lifestyle
I will be your personal stylist,Lifestyle
I will create an automated shopify dropshipping online store,Technology
"I will do economics,Lifestyle
"I will add vietnamese subtitle to english video,Technology
"I will do web scraping,Technology
I will master your album professionally,Technology
I will be your professional rapper for any song,Technology
I will create a visually dynamic case study or testimonial video,Technology
I will user test website and app with software engineer service,Technology
I will teach you python programming,Technology
I will mix or master your electronic music house techno edm plus,Technology
I will create a cooking video recipe,Lifestyle
I will pitch correct your vocal tracks,Technology
I will food cooking youtube channel intro video opener and editing,Lifestyle
I will find manufacturers or suppliers in mexico mexico next china,Marketing
I will help you get your business started,Marketing
I will create a realistic and professional 3d product animation,Technology
I will create professional looking lyric video,Technology
I will give you the baby care book that every new parent must have,Lifestyle
I will help you to maintain your online reputation management,Marketing
I will record american female voice over neutral accent,Technology
I will make animated streaming alert from your logo,Technology
I will create custom explainer video animation,Technology
I will research your genealogy and create your family tree,Lifestyle
"I will list your token on a cryptocurrency exchange,Technology
I will design you a print on demand ecommerce store,Technology
I will clone any web design into a wordpress,Technology
I will create lottie json and GIF animation for web and mobile app,Technology
I will perform live coaching of your league of legends game,Lifestyle
I will write and illustrate a provisional patent,Marketing
I will professionally create your game trailer or app promo video,Technology
I will help you setup virtual reality and mixed reality streaming,Technology
I will edit your gaming videos professionally,Technology
I will design xamarin forms ui ux for ios android uwp,Technology
I will write amazon suspension appeal letter to reinstate your account,Marketing
I will teach you programming and development,Technology
I will be your personal tutor for maths and physics lessons,Lifestyle
I will do royalty free images related to your content,Lifestyle
I will increase android app installs through google ads,Marketing
I will make a high production value product video,Technology
I will provide analysis on business ethics and csr,Marketing
I will professionally narrate your audiobook,Technology
"I will test your website for usability,Technology
I will create an awesome animation video in german,Technology
I will teach you android and IOS app development with flutter,Technology
I will offer piano lessons online,Technology
I will create loop animations for streamers brb starting soon,Technology
I will create custom animated loop video for twitch and youtube,Technology
I will provide your managed cybersecurity services,Technology
I will make 10 seconds of stop motion animation video,Technology
I will take care of your US trademark from start to finish,Marketing
I will make DIY origami beautiful craft videos in 24 hours,Lifestyle
I will help you with any kind of matlab problems,Technology
I will create stinger transitions for streamers,Technology
I will create a vaporwave and vhs themed video,Lifestyle
I will create lifetime energy assistant with selected abilities,Lifestyle
"I will make any slideshow video with photo,Technology
"I will edit,Technology
"I will do a celebrity voice over,Lifestyle
I will sing excellent male vocals or harmonies on any song,Technology
I will be your singer and songwriter,Technology
I will share your link to super active official social media pages,Marketing
I will do awesome animated lyric video to your song,Technology
I will do high quality mobile app development for androids and ios,Technology
I will convert your kids drawing to HTML5 game,Technology
"I will technical support it,Technology
I will give you a powerful talisman spell to change your destiny,Lifestyle
I will conduct market research and build business plan,Marketing
I will turn presentation slides into animation elearning video,Technology
"I will do youtube intro,Technology
"I will compose,Technology
I will find expired domain having backlinks from high authority site,Marketing
I will create a professional webinar video invitation,Technology
"I will design shopify store ,Marketing
"I will develop a training course,Marketing
I will upload 100 products to your woocommerce shopify store,Marketing
I will take professional headshots for business or personal use,Technology
I will create a cute paper craft video for you,Lifestyle
"I will handle communication essays,Lifestyle
I will create image content and upload it into your digital signage,Marketing
"I will be your life coach,Lifestyle
I will build your custom google spreadsheet,Technology
I will unbox your tech product on my channel in 4k,Technology
I will create a stylish animated explainer video for your company,Technology
I will distribute your flyers throughout los angeles popular areas,Marketing
I will convert article and blog into a stunning video with voice over,Technology
I will put your photo or logo on laptop,Lifestyle
I will do organic spotify promotion to united states users,Marketing
"I will convert script,Technology
I will produce your visual music video or lyric video,Technology
I will be your business consultant and mentor or coach to empower growth,Marketing
I will assemble paint and base your wargaming warhammer miniatures,Lifestyle
"I will do salesforce customization,Marketing
I will choreograph a praise dance routine for you,Lifestyle
I will automate excel formula pivot table excel vba macros dashboards,Technology
I will bulid twilio bulk sms bot and voice application,Technology
I will be your investment or loan startup business plan writer or business proposal,Marketing
"I will list your cannabis,Marketing
"I will be your singer,Technology
I will print and distribute flyers in ca and ny busiest areas,Marketing
I will make nursery rhymes and cartoon songs videos,Technology
"I will provide insightful,Technology
I will spraypaint your logo or image on a graffiti wall video,Technology
I will narrate an audio book summary,Technology
I will assist you in full lifecycle project management,Marketing
I will create an outstanding short animated GIF,Technology
"I will convert blog post,Technology
I will create lofi hip hop animations,Technology
I will create a jingle for your brand or youtube channel,Technology
I will create best 2d nursery rhymes video for kids,Technology
I will create an original audio logo for your brand,Technology
I will design and develop your shopify dropshipping store,Technology
"I will test your website or apps functionality,Technology
"I will code cpp,Technology
I will do travel guides in spanish and english,Lifestyle
I will set up your etsy shop or do a complete overhaul,Marketing
I will create an eye catching real estate promo video,Technology
I will design your organizational structure and staff roles,Marketing
I will be a female model for video brand and service,Lifestyle
I will do professional color correction and color grading,Technology
I will create animated marketing video for business and sales,Technology
"I will create a cinematic teaser trailer ,Technology
I will design non profit website for nonprofit charity donations,Technology
"I will develop a lucid business plan,Marketing
I will appraise your domain names,Marketing
"I will create animated brb,Technology
"I will do statistical data analysis using spss,Technology
I will make attractive real estate promo video for your agency,Technology
I will screencast an instructional video for you,Technology
I will voice and produce epic podcast intros,Technology
I will do transcribing and create srt or cc for your videos,Technology
I will create a offering memorandum package,Marketing
I will create a personalized video for you from marilyn monroe,Lifestyle
I will edit your audiobook for acx audible,Technology
I will find qualitative expired domain research for 301 redirect backlinks,Marketing
"I will musical,Technology
I will do vocal tuning and harmony fx for vocals,Technology
"I will upload products on woocommerce,Marketing
"I will do  facebook promotion ads campaign twitter,Marketing
I will create a functional and beautiful shopify website,Technology
I will create a cedh or edh decklist,Lifestyle
I will give you first online yoga class in 5 dollar,Lifestyle
I will animate and rig 3d characters,Technology
I will optimize your gmb listing for local SEO,Marketing
I will create a retro pixel art style animation or GIF,Technology
I will full penetration and security testing,Technology
I will create any video or vsl with stock footages in 24 hrs,Technology
I will create a vocal tag drops for producers artist and djs,Technology
I will make a perfect cooking recipe video slideshow,Lifestyle
I will record a video from japan,Lifestyle
I will paint or sculpt incredible miniatures,Lifestyle
I will be your female product model for photo or video,Technology
I will perform QA review and testing for websites and mobile apps,Technology
I will find and create a shopify dropshipping store,Marketing
I will provide advanced world class mixing and mastering services,Technology
I will develop script or extension or plugin for adobe products,Technology
I will mix and master your pop or rock song in one day radio ready,Technology
I will develop android and ios app with admin panel,Technology
I will create live action explainer video,Technology
I will get to platinum on rainbow six siege ranked,Lifestyle
I will develop robust android and IOS applications using flutter,Technology
"I will create a color palette for your logo,Marketing
I will help you with anything IT related,Technology
I will create shopify dropshipping store or shopify website,Technology
"I will create a promo video for your church,Technology
I will choose your level to write a successful  business proposal,Marketing
I will provide fulltime email support and customer service,Marketing
I will help you source the best talent in philippines,Marketing
I will make movie and book trailer,Technology
I will write complete business plan with financial projection,Marketing
I will print custom sticker labels waterproof,Marketing
I will train you in project management methodologies and tools,Marketing
I will shoot professional portraits for your company,Technology
I will be your virtual assistant,Marketing
I will do amazon product research for private label fba research,Marketing
I will do anything related to electrical engineering,Lifestyle
I will create an awesome airtable base and free post sales support,Technology
I will coach you in apex legends ps4,Lifestyle
I will create high end product photography that boost ecomm sales,Technology
I will write a professional statement of work for you to contract with,Marketing
I will provide 10 forum posts,Marketing
I will create animated marketing video for sales,Technology
I will do web scraping from almost any website,Technology
I will create a custom section or template in notion,Technology
"I will make the best risk,Marketing
I will make your funny ideas in my videos,Lifestyle
"I will develop live streaming website and live streaming app,Technology
I will build sales funnel or landing page in clickfunnels,Technology
"I will give you unlimited organic web traffic to your site,Marketing
I will present a live action video for your business,Technology
I will create a custom premium whiteboard animation video,Technology
I will record a beach or ocean scene unedited for your own use,Technology
"I will setup or fix a,Technology
I will provide 4 uk seo gigs in 1 citations directories and links,Marketing
I will send you 2 hours worth of powerful distant reiki healing to anything you want,Lifestyle
I will do guest post on da30 auto blog,Marketing
I will be your business consultant and teach you how to succeed,Marketing
I will create sticker gifs for your instagram brand,Technology
I will create custom intro and outro with your logo,Technology
"I will make a twitch chat bot,Technology
"I will record and produce your ad for radio,Technology
I will transcribe anything into midi,Technology
"I will do cold calling,Marketing
I will write a professional business plan for your startup company,Marketing
I will do perfect website and mobile applications QA testing,Technology
I will create an amazing ico or cryptocurrency promo video,Technology
I will complete a psychic thought implant session,Lifestyle
I will create a squarespace website design or redesign,Technology
"I will create unique vision,Marketing
"I will test ur desktop,Technology
I will edit and tune your vocals and make them ready for mixing,Technology
I will do pro dance choreography,Lifestyle
I will make a high quality custom discord bot,Technology
I will promote your business or company with  an amazing video,Technology
I will create a modern corporate presentation video like this one,Technology
I will make 50 glitter coloring pages videos for youtube kids,Technology
I will cast a custom spell,Lifestyle
I will transcribe or arrange any song to sheet music or guitar tab,Technology
I will create anything with particles and vfx,Technology
I will create a clean and modern wordpress website,Technology
I will teach you paper crafting,Lifestyle
I will funny and fun challenges,Lifestyle
I will write lyrics in russian or english and sing for you,Technology
I will mix and master your hip hop rap pop edm song,Technology
I will design professional training and workshop courses,Marketing
I will coach you and help you in rank on apex legends,Lifestyle
I will promote your song on our playlists,Marketing
"I will create catchy,Technology
I will make realistic 3d advertising animation videos,Technology
"I will remove spirits,Lifestyle
I will review your website and suggest  improvements in 72 hours,Technology
I will do web scraping or data mining of any website for you,Technology
I will shoot up to 5 products for your ecommerce store,Technology
"I will drive organic web traffic from usa to your website store,Marketing
I will be your remote HR consultant,Marketing
I will produce an engaging commercial,Technology
I will write the lyrics and create the vocal melody for your song,Technology
I will create a custom animated loop for your music videos,Technology
"I will do realistic matte painting,Technology
I will research your danish ancestors,Lifestyle
I will create 100 percent unique custom intro logo animation,Technology
I will do any arduino uno project with simulation,Technology
I will take custom photos and send them digitally or framed,Technology
"I will do professional  podcast editing,Technology
"I will create best animated twitch overlays,Technology
I will guest post on da 56 google news approved sites,Marketing
I will do video editing for your music video or project,Technology
I will record professional studio quality guitar,Technology
"I will send hiphop,Technology
I will get your nonprofit started and give you all you need to get funded,Marketing
I will solve your excel or google sheets problem,Technology
I will add subtitles in srt file or burn inside video,Technology
I will set up a trello board for you,Marketing
"I will generate reports in ms excel,Technology
I will comp and tune your vocals,Technology
I will build high authority editorial backlinks via 301 redirect from top websites,Marketing
I will paint your miniatures and models for you,Lifestyle
I will create animation with your 3d character,Technology
I will say anything you want as a heavy metal man in a video,Lifestyle
I will be your fashion and style consultant,Lifestyle
"I will design shopify store ,Technology
I will assist you in project management,Marketing
I will cast a love spell with powerful white magic,Lifestyle
I will cast custom ancient spell and make your destiny as you want,Lifestyle
I will build your professional dropshipping shopify store,Technology
I will produce a animated ebook promotion video for your ebook,Technology
I will do data analysis  and econometric modelling,Technology
"I will product photography for your company,Technology
I will create curate your pinterest for shopify ebay etsy amazon,Marketing
I will be your lyricist music composer and singer,Technology
I will write you an outstanding  startup business plan for investors or loan,Marketing
I will do QA and test automation on mobile and web applications,Technology
I will master and format your audiobook for acx and audible,Technology
I will create professional 2d animation video for real estate,Technology
I will do any work in ruby on rails,Technology
I will create a 30 minute podcast for your business,Technology
I will give you singing voice lessons packages,Technology
I will rank your app on play store by aso and SEO,Marketing
I will record a professional piano instrumental cover of any song,Technology
"I will do vfx,Technology
I will create a professional australian radio commercial,Technology
"I will unity 2d,Technology
I will create a traditional 2d cartoon animation,Technology
"I will design branded shopify website,Technology
"I will create amazing,Technology
I will create lofi loop animation,Technology
I will do lead generation by linkedin sales navigator use,Marketing
I will create amazing real estate commercial in 4hrs,Technology
"I will help you in math,Lifestyle
I will invent unique business name brand name with  logo design,Marketing
I will make a personalized doc brown birthday video or promo video,Lifestyle
I will create an epic live action cinematic book trailer for you,Technology
I will add and or translate your subtitles from english or german,Technology
I will record a professional german male voiceover,Technology
I will setup your company VPN for remote work,Technology
I will be your online personal fitness trainer and nutritionist,Lifestyle
I will teach you how to use tableau desktop,Technology
I will create custom professional cinematic trailer for your book,Technology
I will create a highly customized promo video for your app or web,Technology
"I will develop professional android iptv and movies app like egybest,Technology
I will make custom animated gif and motion graphics video,Technology
I will create an unboxing video for your product,Technology
I will enhance and repair your speech audio,Technology
I will make a drawing lyrics video to your song,Technology
I will do sensory custom intro outro animated logo,Technology
"I will teach you html,Technology
I will answer anything you want to know before travel to malaysia,Lifestyle
I will teach you fabrication welding skills and knowledge,Lifestyle
"I will do bookkeeping for ecommerce amazon fba,Marketing
I will create an unboxing video for your product,Technology
I will draw coloring pages for children,Lifestyle
I will produce your video course,Technology
"I will convert script,Technology
I will make you a csgo fragmovie,Technology
I will do any roofing xactimate estimates,Marketing
I will create custom elegant 3d logo animation,Technology
I will repost your house music track to 200k network on soundcloud,Marketing
I will create a minimalist corporate presentation in power point,Technology
I will make real estate cold calls for you,Marketing
I will draw line drawing for coloring book,Lifestyle
I will do opengl and webgl programming,Technology
I will shoot professional product photography,Technology
I will create an real estate tour video,Technology
I will architecture 3d animation for your design,Technology
I will create and convert your power point presentation into HD video in 5 hour,Technology
I will be your professional model,Lifestyle
"I will compose a synthwave,Technology
"I will help in maths,Lifestyle
I will create a professional promotional video ad,Technology
I will provide you with a market and competitor analysis,Marketing
I will scan and clean your website from malware,Technology
I will be your front end developer and designer,Technology
I will be your professional photo and video model,Lifestyle
"I will create a professional video,Technology
I will create a game trailer for you,Technology
I will film a green screen video,Technology
I will remove hijackers from your amazon listing,Marketing
"I will do landuse modelling,Technology
I will develop your game idea or prototype it,Technology
I will design database for your project and write queries,Technology
I will make gta 5 machinima cinematic movies for you,Technology
I will be your online personal trainer,Lifestyle
"I will write your python scripts,Technology
"I will model,Technology
I will make happy birthday video from donald trump,Lifestyle
I will create totally rad custom gifs and digital stickers,Technology
I will create a whatsapp marketing tool that sends bulk messages,Technology
"I will write terms and conditions,Marketing
I will ice dance hip hop on your song,Lifestyle
I will setup real estate sellers lead campaign for you,Marketing
"I will do perfect data entry,Marketing
I will do the best trump impression on fiverr,Lifestyle
I will teach you how to make a beat or how to use ableton,Technology
I will create custom video logo animation,Technology
I will do deep market research and competitor analysis within 24 hours,Marketing
I will create amazon storefront for your products,Marketing
I will create animated marketing video for business and sales,Technology
I will provide aso to increase downloads for ios or android apps,Marketing
I will do expert amazon private label product research fba,Marketing
I will be your online personal trainer at the gym or at home,Lifestyle
I will review your shopify store and give you a list of changes,Technology
"I will do web scraping,Marketing
I will convert your power point presentation into video,Technology
